Índice,Aba,Processo,Relator/Relatora,Data da Publicação,Decisão,PDF Link,Link Recurso Repetitivo
551,Decisões Monocráticas (1.183),RMS 74614,Ministra REGINA HELENA COSTA,DJEN 06/10/2025,"RECURSO EM MANDADO DE SEGURANÇA Nº 74614 - MS (2024/0352645-7) DECISÃO Vistos. Trata-se de Recurso Ordinário em Mandado de Segurança interposto por HERLON MOREIRA CABRAL com base nos arts. 105, II, b, da Constituição da República e 1.027, II, a, do Código de Processo Civil de 2015, contra acórdão proferido pelo Tribunal de Justiça do Estado de Mato Grosso do Sul, assim ementado (fls. 275/276e): MANDADO DE SEGURANÇA - CONCURSO PÚBLICO - ESTRUTURA FUNCIONAL DO PODER JUDICIÁRIO DO ESTADO DE MATO GROSSO DO SUL, PARA O CARGO DE TÉCNICO DE NÍVEL SUPERIOR - ENGENHEIRO CIVIL. IMPETRANTE APROVADO FORA DO NÚMERO DE VAGAS PARA CONVOCAÇÃO DA VERIFICAÇÃO DA CONDIÇÃO DECLARADA NO QUESITO COR OU RAÇA. PROVIMENTO DE TODAS AS VAGAS DISPONIBILIZADAS. CONDIÇÃO FÁTICA NÃO DEMONSTRADA - DIREITO LÍQUIDO E CERTO À NOMEAÇÃO NÃO RECONHECIDO. SEGURANÇA DENEGADA. O recorrente narra que foi habilitada na 5ª posição das vagas destinadas às cotas raciais. Não obstante, com a exclusão do candidato classificado em 4º lugar, o Recorrente passou a ocupar sua posição e deveria ter sido convocado para a banca de verificação da autodeclaração étnico-racial, conforme previsto no edital, o que não ocorreu. Além disso, alega que foi desconsiderado que, diante da desistência dos candidatos em 2º e 3º lugares, o Recorrente alcançou a 2ª colocação, caracterizando direito líquido e certo à nomeação. Contrarrazões às fls. 313/316e, subiram os autos a esta Corte. O Ministério Público Federal manifestou-se às fls. 356/362e, opinando pelo provimento do recurso. Feito breve relato, decido. Nos termos do art. 932, IV, do Código de Processo Civil, combinado com o art. 34, XVIII, b, do Regimento Interno desta Corte, o Relator está autorizado, por meio de decisão monocrática, a negar provimento a recurso ou pedido contrário à tese fixada em julgamento de recurso repetitivo ou de repercussão geral (arts. 1.036 a 1.041), a entendimento firmado em incidente de assunção de competência (art. 947), à súmula do Supremo Tribunal Federal ou desta Corte ou, ainda, à jurisprudência dominante acerca do tema, consoante Enunciado da Súmula n. 568/STJ: O Relator, monocraticamente e no Superior Tribunal de Justiça, poderá dar ou negar provimento ao recurso quando houver entendimento dominante acerca do tema. Preenchidos os pressupostos de admissibilidade, passo ao exame do recurso. Extrai-se dos autos que o recorrente foi em 5º lugar dentre os candidatos cotistas que poderiam ser nomeados para o cargo), não atingindo a colocação necessária para a realização de perícia de verificação de heteroidentificação, porquanto o edital do certame previa apenas o chamamento dos 4 primeiros colocados. O TJMS denegou a ordem, afirmando que a convocação para a banca de heteroidentificação foi limitada aos quatro primeiros colocados da lista de cotas, em conformidade com o edital que previa duas vagas reservadas e o dobro de candidatos avaliados. Como o Impetrante se encontrava inicialmente em 5º lugar, não foi convocado, não podendo ser reclassificado posteriormente, quando já esgotada a fase avaliativa. Destacou, ainda, que apenas oito engenheiros civis chegaram a ser nomeados no prazo de validade do certame, o que não implicaria descumprimento das regras de reserva de vagas. Por fim, ressaltou tratar-se de concurso para cadastro de reserva, no qual não há direito subjetivo à nomeação, mas mera expectativa, a ser exercida segundo a conveniência e oportunidade da Administração. De fato, ao contrário do que alega o recorrente, inexiste direito líquido e certo à convocação para a etapa subsequente, porquanto o candidata não foi classificado dentro das vagas previstas edital para submissão à banca de avaliação, estando em classificação posterior à cláusula de barreira. Cumpre destacar que a medida restritiva adotada pela Administração Pública quanto a um quantitativo de provas a ser corrigido se constitui na chamada Cláusula de Barreira, amplamente utilizada e aceita por doutrina e jurisprudência pátrias. Anoto que esta Corte encampa a orientação de que é legítima regra prevista no edital de concurso mediante a qual limita-se o número de candidato participantes em cada fase do certame, com o objetivo de selecionar apenas os candidatos que obtiveram as melhores notas, como estampam os seguintes precedentes: PEDIDO DE RECONSIDERAÇÃO RECEBIDO COMO AGRAVO REGIMENTAL. POSSIBILIDADE. PRECEDENTES. CONCURSO PÚBLICO. CLÁUSULA DE BARREIRA. AMPARO CONSTITUCIONAL RECONHECIDO PELO SUPREMO TRIBUNAL FEDERAL NO RE Nº 635.739/AL. PEDIDO DE RECONSIDERAÇÃO RECEBIDO COMO AGRAVO REGIMENTAL E DESPROVIDO. 1. O Pretório Excelso, em 19/02/2014, ao julgar o mérito do RE n.º 635.739/AL, reconheceu ""[...] a legitimidade constitucional da regra inserida no edital do concurso público com o intuito de selecionar apenas os candidatos mais bem classificados para prosseguir no certame"". 2. Pedido de reconsideração recebido como agravo regimental e desprovido. (RCD no RE nos EDcl no AgRg no RMS 27.061/CE, Rel. Ministra LAURITA VAZ, CORTE ESPECIAL, julgado em 19/12/2014, DJe 18/2/2015). ADMINISTRATIVO. AGRAVO REGIMENTAL NO RECURSO ORDINÁRIO EM MANDADO DE SEGURANÇA. CONCURSO PÚBLICO PARA INGRESSO NO CARGO DE AGENTE DE TRÂNSITO DA CARREIRA DE POLICIAMENTO E FISCALIZAÇÃO DE TRÂNSITO. CONSTITUCIONALIDADE DA CLÁUSULA DE BARREIRA. JURISPRUDÊNCIA DO SUPREMO TRIBUNAL FEDERAL. REPERCUSSÃO GERAL: RE 635.739/AL. CANDIDATO EXCEDENTE. CRITÉRIOS OBJETIVOS DA NORMA EDITALÍCIA PARA ELIMINAÇÃO. ALEGAÇÃO DE EXISTÊNCIA DE VAGAS PARA O CURSO DE FORMAÇÃO. INEXISTÊNCIA DE DIREITO LÍQUIDO E CERTO. AGRAVO REGIMENTAL DESPROVIDO. 1. Alinhando-se ao Supremo Tribunal Federal, que decidiu, no julgamento do RE 635.739/AL, pelo regime da repercussão geral, ser válida a chamada cláusula de barreira, este Superior Tribunal de Justiça, em caso análogo ao dos autos, entendeu incidir a referida cláusula para a convocação de determinado número limite de candidatos para as etapas subsequentes, considerando-se eliminados os candidatos excedentes a isso, não conferindo direito líquido e certo ao candidato que, depois de excluído do certame, alega ter obtido a informação da existência de mais vagas que poderiam ser oportunamente providas pelo mesmo concurso público. 2. Agravo Regimental desprovido. (AgRg no RMS 44.171/DF, Rel. Ministro NAPOLEÃO NUNES MAIA FILHO, PRIMEIRA TURMA, julgado em 28/04/2015, DJe 15/05/2015). ADMINISTRATIVO. PROCESSUAL CIVIL. CONCURSO PÚBLICO. POLÍCIA MILITAR ESTADUAL. PRIMEIRA ETAPA - ELIMINATÓRIA E CLASSIFICATÓRIA. CANDIDATOS APROVADOS NA PROVA ESCRITA E NÃO CLASSIFICADOS NO LIMITES DO EDITAL. OBEDIÊNCIA AO INSTRUMENTO CONVOCATÓRIO. PARTICIPAÇÃO NA SEGUNDA ETAPA. AUSÊNCIA DE DIREITO LÍQUIDO E CERTO. 1. Cuida-se de recurso ordinário interposto contra acórdão no qual se denegou a ordem ao mandado de segurança impetrado com o fito de obter a convocação à segunda fase do concurso para soldado da Polícia Militar do Estado do Maranhão, sob o argumento de aprovação na prova objetiva. 2. É certo que o item 8.6 do Edital SEGEP n. 03/2012 estabelecia a nota mínima de 24 pontos para aprovação na prova objetiva; todavia, o item 9 do mesmo edital fixa um limite de 3.000 aprovados, em ordem classificatória para a segunda fase, e resta comprovado que os recorrentes não obtiveram classificação compatível à convocação. 3. ""O impetrante atingiu a pontuação mínima exigida para passar à etapa seguinte do concurso, mas não se classificou entre os 3.000 melhores colocados, daí decorrendo sua eliminação no certame; ausente, portanto, seu direito líquido e certo"" (MS 13.056/DF, Rel. Ministro Napoleão Nunes Maia Filho, Terceira Seção, DJe 26/5/2008). Recurso ordinário improvido. (RMS 47.043/MA, Rel. Ministro HUMBERTO MARTINS, SEGUNDA TURMA, julgado em 10/02/2015, DJe 19/02/2015). Posto isso, com fundamento no art. 932, IV, do Código de Processo Civil de 2015 e art. 34, XVIII, b, do Regimento Interno desta Corte, CONHEÇO E NEGO PROVIMENTO ao Recurso Ordinário. Publique-se e intimem-se. Brasília, 02 de outubro de 2025. REGINA HELENA COSTA Relatora",https://processo.stj.jus.brhttps://processo.stj.jus.br/processo/pesquisa/?num_registro=202403526457;,
552,Decisões Monocráticas (1.183),PUIL 5376,Ministra NANCY ANDRIGHI,DJEN 06/10/2025,"PEDIDO DE UNIFORMIZAÇÃO DE INTERPRETAÇÃO DE LEI Nº 5376 - DF (2025/0356256-0) EMENTA PEDIDO DE UNIFORMIZAÇÃO DE INTERPRETAÇÃO DE LEI. ACÓRDÃO IMPUGNADO PROFERIDO POR TURMA RECURSAL DE JUIZADO ESPECIAL ESTADUAL. NÃO CABIMENTO. PREVISÃO LEGAL RESTRITA PARA AS HIPÓTESES PREVISTAS NOS ARTIGOS 14, § 4º, DA LEI 10.259/2001 E 18, § 3º, E 19, CAPUT, DA LEI 12.153/2009. 1. Pedido de uniformização de interpretação de lei. 2. Esta Corte apenas detém competência para o julgamento dos pedidos de uniformização de interpretação de lei federal deduzidos no âmbito dos Juizados Especiais Federais (art. 14, § 4º, da Lei 10.259/2001) e dos Juizados Especiais da Fazenda Pública (art. 18, § 3º, e 19, caput, da Lei 12.153 /2009). Precedentes. 3. Hipótese em que o pedido foi formulado contra acórdão proferido por Turma Recursal de Juizado Especial Estadual. 4. Pedido de uniformização de interpretação de lei não conhecido. DECISÃO Examina-se pedido de uniformização de interpretação de lei federal formulado por ERICK SANTOS BARROS contra acórdão do Colégio Recursal dos Juizados Especiais do TJDFT. Ação: indenização por danos materiais e morais, ajuizada por ERICK SANTOS BARROS em face de RHINO AUTOPARTS DISTRIBUIDORA E IMPORTADADORA DE AUTO PEÇAS LTDA. Sentença: extinguiu o processo sem resolução do mérito (fls. 184-185 e-STJ). Acórdão: negou provimento ao recurso inominado interposto por ERICK SANTOS BARROS, nos termos da seguinte ementa (fls. 300-301 e-STJ): DIREITO DO CONSUMIDOR. RECURSO INOMINADO. COMPRA DE PRODUTO (COMPRESSOR VEICULAR DE CONDICIONADOR DE AR). VÍCIO OCULTO NÃO CARACTERIZADO. DEFEITO OCORRIDO FORA DA GARANTIA. TEORIA DA CAUSA MADURA. DECADÊNCIA RECONHECIDA DE OFÍCIO. DANOS MATERIAL E MORAL NÃO INDENIZÁVEIS. RECURSO DESPROVIDO. I. CASO EM EXAME 1. Recurso inominado interposto pelo autor em face da sentença que extinguiu o processo sem exame do mérito (art. 51, II, Lei 9.099/95), diante da necessidade de perícia para comprovação do defeito. 2. Nas razões recursais suscita preliminar de cerceamento de defesa, alegando a competência dos Juizados Especiais. No mérito pugna pela inversão do ônus da prova, pela condenação solidária das rés à restituição do valor pago (R$ 1.916,91) e pela reparação moral em valor a ser arbitrado pelo colegiado. II. QUESTÃO EM DISCUSSÃO 3. A controvérsia recursal impõe verificação do direito do autor às reparações material e moral em razão do vício do produto (compressor de ar do condicionador veicular). III. RAZÃO DE DECIDIR 4. A relação jurídica destes autos apresenta natureza consumerista, o que atrai a aplicação do Código de Defesa do Consumidor, em razão da caracterização das partes como consumidor e fornecedor, na forma preceituada nos artigos 2º e 3º da Lei 8.078/90, sem prejuízo da aplicação supletiva dos preceitos insertos no CC, em necessário diálogo das fontes. 5. Preliminar de cerceamento de defesa. Verificada nos autos a presença de elementos de convicção suficientes para o julgamento do processo, não há que se falar em necessidade de realização de perícia . Preliminar rejeitada. 6. No presente caso aplica-se a Teoria da Causa Madura, pois o processo se encontra em condição de imediato julgamento de mérito, sem necessidade de devolução dos autos ao juízo de origem (art. 1.013, § 3º, II, do CPC/2015). 7. No caso, o autor adquiriu em 08/01/2024 um compressor veicular de condicionador de ar, com garantia contratual de seis meses, sem garantia estendida. Ocorre que em dezembro/2024 (ID 70652016) deu notícia à parte ré de que a peça havia apresentado defeito, quando não mais havia obrigação das rés no reparo do defeito apresentado, impondo o reconhecimento de ofício da decadência. Precedente: Acórdão 1954128. 8. Vale ressaltar que não há qualquer indício de prova da caracterização de vício oculto, mas pelo que dos autos consta, trata-se de vício em produto de uso diário, que ocorreu (art. 26/CDC) quase um ano após a compra e após o prazo decadencial e de garantia. IV. DISPOSITIVO 9. Recurso desprovido. 10. Condenado o autor recorrente nas custas processuais e nos honorários advocatícios arbitrados em 10% sobre o valor corrigido da causa (art. 55, Lei 9.099/95), suspensa a exigibilidade em razão da gratuidade judiciária. 11. A súmula de julgamento servirá de acórdão, consoante disposto no artigo 46 da Lei 9.099/95. Embargos de declaração: opostos por ERICK SANTOS BARROS, foram rejeitados (fls. 351-353 e-STJ). Recurso inominado: defende que o acórdão proferido pela Segunda Turma Recursal dos Juizados Especiais de Distrito Federal viola o art. 26, § 3º, da Lei nº 8.078/90, sob o argumento de que, em se tratando de vício oculto, o terno inicial do prazo decadencial de 90 (noventa) dias para reclamação ocorre quando o defeito se torna evidente, irrelevante o transcurso do prazo de garantia contratual. RELATADO O PROCESSO, DECIDE-SE. DO CABIMENTO DO PUIL Conforme bem delineado pela Primeira Seção no julgamento do RCD na Rcl 14 /730/SP (DJe de 24/02/2015), o sistema para processo e julgamento de causas em juizados especiais é composto por três microssistemas: a) Juizados Especiais Estaduais Comuns, instituídos pela Lei 9.099/1995; b) Juizados Especiais Federais, instituídos pela Lei 10.259/2001 e; c) Juizados Especiais da Fazenda Pública Estadual e Municipal, instituídos pela Lei 12.153/2009. Cada um desses microssistemas é submetido a regras processuais e procedimentais específicas, sendo que, no tocante à uniformização de jurisprudência, apenas as leis que dispõem sobre Juizado Especial Federal e sobre Juizados Especiais da Fazenda Pública previram a possibilidade de se efetuar pedido de uniformização de interpretação de Lei federal perante o STJ, conforme estabelecem os arts. 14, § 4º, da Lei 10.259/2001 e 18, § 3º, e 19, caput, da Lei 12.153/2009. Desse modo, esta Corte apenas detém competência para o julgamento dos pedidos de uniformização de interpretação de Lei federal deduzidos no âmbito dos Juizados Especiais Federais e dos Juizados Especiais da Fazenda Pública. Nesse sentido: AgRg nos EDcl no PUIL 694/SP, 3ª Seção, DJe 02/04/2018; e AgInt no PUIL 1.751 /BA, 2ª Seção, DJe 04/09/2020. A hipótese dos autos, conforme relatado, diz respeito a pedido de uniformização de entendimento no âmbito de Juizado Especial Estadual, cujo exame, portanto, foge à competência do STJ. Nesse sentido: AgInt no PUIL 1.798/BA, 2ª Seção, DJe 02/10/2020. Forte nessas razões, NÃO CONHEÇO do presente pedido de uniformização de interpretação de lei, com fundamento no art. 932, III, do CPC/15. Publique-se. Intimem-se. Brasília, 01 de outubro de 2025. MINISTRA NANCY ANDRIGHI Relatora",https://processo.stj.jus.brhttps://processo.stj.jus.br/processo/pesquisa/?num_registro=202503562560;,
