Índice,Aba,Processo,Relator/Relatora,Data da Publicação,Decisão,PDF Link,Link Recurso Repetitivo
351,Decisões Monocráticas (1.055),AREsp 3012331,Ministra MARIA THEREZA DE ASSIS MOURA,DJEN 06/10/2025,"AGRAVO EM RECURSO ESPECIAL Nº 3012331 - RJ (2025/0299961-0) EMENTA DIREITO ADMINISTRATIVO E PROCESSUAL CIVIL. AGRAVO EM RECURSO ESPECIAL QUE NÃO COMBATEU OS FUNDAMENTOS DA DECISÃO AGRAVADA. DESCUMPRIMENTO DO PRINCÍPIO DA DIALETICIDADE. INCIDÊNCIA DOS ARTS. 932, III, DO CPC E 253, P. Ú, I, DO RISTJ. AGRAVO NÃO CONHECIDO. DECISÃO Trata-se de agravo em recurso especial interposto pelo MUNICÍPIO DO RIO DE JANEIRO, contra inadmissão, na origem, de recurso especial fundamentado na alínea ""a"" do inciso III do artigo 105 da Constituição Federal, manejado contra acórdão do Tribunal de Justiça do Estado do Rio de Janeiro, assim ementado (fl. 3.882): APELAÇÃO CÍVEL. FAZENDA PÚBLICA. EMBARGOS À EXECUÇÃO DE TÍTULO EXTRAJUDICIAL. PRESTAÇÃO DE SERVIÇOS DE OXIGENOTERAPIA PARA A SECRETARIA MUNICIPAL DE SAÚDE. 1. Nulidade da execução por alegada inexistência de liquidez, exigibilidade e certeza que se afasta. Execução fundada em contrato administrativo que atestam a efetivação do serviço. 2. Prova dos autos, com a perícia dos procedimentos administrativos, que dá conta de que os serviços foram reconhecidamente prestados. 3. Excesso de execução não demonstrado. Planilha trazida pela exequente que pode considerar o valor originário acrescido dos encargos de mora e correção monetária, apurados posteriormente no laudo pericial. Honorários que devem ser fixados na forma prevista no artigo 85, §3º, do NCPC, no percentual mínimo de cada faixa, observado o §5º. 4. 1º recurso provido, 2º recurso desprovido e reforma parcial da sentença de ofício. Opostos embargos declaratórios, foram estes rejeitados, em aresto assim ementado (fl. 3.944): EMBARGOS DE DECLARAÇÃO. INEXISTÊNCIA DE OMISSÃO, CONTRADIÇÃO OU OBSCURIDADE. 1. Conforme se pode observar, a matéria foi devidamente apreciada pelo acórdão embargado, cabendo ressaltar, como dito no referido julgado, que a alegada necessidade de cotejamento dos serviços que teriam sido prestados com as respectivas ações judiciais de onde teriam emanado as determinações não foi matéria levantada na exordial, não havendo no item 8 a dedicação de uma linha sequer neste sentido. 2. Os Embargantes pretendem, claramente, somente prequestionar a matéria para eventuais recursos ao Supremo Tribunal Federal e Superior Tribunal de Justiça, mas, não estando presentes os requisitos do artigo 1022 do NCPC, não encontram viabilidade os presentes Embargos Declaratórios. 3. Desprovimento de ambos os Embargos. Em seu recurso especial, às fls. 3.951-3.965, o recorrente sustenta violação aos arts. 489, inciso II, e §1º, incisos I a IV, e 1.022, inciso I, ambos do Código de Processo Civil, uma vez que, mesmo sendo opostos embargos de declaração, o Tribunal a quo não sanou as obscuridades e as contradições constantes no acórdão recorrido. Aduz, ainda, ofensa aos arts. 7º e 477, §2º, incisos I e II, ambos do Código de Processo Civil, argumentando, para tanto, que (fl. 3.959): O acórdão recorrido tomou por embasamento laudo pericial produzido em perícia nula, por violação ao contraditório, razão pela qual deve ser declarado nulo. Tal como já relatado, após a impugnação ao laudo pericial ofertada pela Municipalidade, o i. perito não promoveu os esclarecimentos devidos, em flagrante violação ao disposto no Artigo 477, §2º, I e II, CPC, o que importa, ainda, em vulneração ao princípio do contraditório e da ampla defesa, bem como da paridade das armas, já que o ente réu saiu prejudicado em fase de instrução probatória sem dela ter podido participar ativamente (Artigo 7º, CPC). Ademais, aponta desrespeito aos arts. 141 e 492, ambos do Código de Processo Civil, tendo em vista que o acórdão recorrido, ""ao dar provimento à apelação, o fez em extensão superior à requerida, tratando-se, portanto, de acórdão ultra petita, em violação ao princípio da congruência"" (fl. 3.963). Por fim, alega que, ""não tendo a Sta Hospitalar instruído sua execução com o demonstrativo do débito, e mais, tendo requerido expressamente a apuração futura das eventuais atualizações monetárias e acréscimos legais pertinentes, verifica-se que a petição inicial não está de acordo com os requisitos próprios da execução por título extrajudicial"" (fl. 3.964), ocorrendo assim violação ao art. 798, inciso I, do Código de Processo Civil. O Tribunal de origem, no entanto, inadmitiu o recurso especial, conforme trecho in verbis (fl. 3.985): A recorrente quando se insurge em relação à multa, pretende, por via transversa, a revisão de matéria de fato, apreciada e julgada com base nas provas produzidas nos autos e, ainda, na interpretação do contrato, o que encontra óbice nas Súmulas 5 e 7 do STJ, verbis: ""Súmula 5: A simples interpretação de cláusula contratual não enseja recurso especial. Súmula 7: A pretensão de simples reexame de prova não enseja Recurso Especial"". O acórdão decidiu com base nos fatos e nas provas dos autos e, ainda, no contrato firmado entre as partes. Assim, eventual modificação da conclusão do colegiado passaria pela seara fático-probatória, soberanamente decidida pelas instâncias ordinárias, de modo que não merece trânsito o recurso especial, ante o veto do Enunciado nº 7 da Súmula do STJ. Da mesma forma, é patente a necessidade de interpretação das cláusulas contratuais, o que é obstado pelo Verbete nº 5 da Súmula do Superior Tribunal de Justiça. Em seu agravo, às fls. 4.000-4.012, o agravante afirma que ""a decisão agravada merece revisão quanto à aplicação da Súmula 7 do STJ, pois a controvérsia não demanda reexame de provas, mas apenas a qualificação jurídica dos fatos incontroversos descritos no acórdão"" (fl. 4.006). No mais, sustenta que (fl. 4.011): O objetivo do recurso especial interposto pelo Município não é discutir as possíveis interpretações das cláusulas contratuais, mas sim, de aplicar as normas cogentes, obrigatórias, de direito público, que foram afastadas sob o equivocado fundamento de preservação das condições avençadas contratualmente e não revolvimento de questões fático- probatórias. (...) Depreende-se, portanto, que a discussão extrapola qualquer relação ou pretensão de interpretação de cláusula contratual, absolutamente dispensável à hipótese, não sendo o caso de aplicação da Súmula 5 do STJ. É o relatório. Decido. O recurso não comporta conhecimento. De início, verifica-se que não foi impugnada a integralidade da fundamentação da decisão agravada, porquanto o agravante não infirmou especificamente nenhum dos fundamentos utilizados para a inadmissão do seu recurso especial. Em verdade, a decisão monocrática que negou a subida do apelo raro, ora agravada, assentou-se em dois fundamentos distintos: (i) - incidência do enunciado 7 da Súmula do STJ, tendo em vista a impossibilidade de revisão do acervo probatório e (ii) - incidência do enunciado 5 da Súmula do STJ, em razão da impossibilidade de reinterpretação de cláusula contratual. Entretanto, em sede de agravo em recurso especial o recorrente deixou de infirmar especificamente e a contento, ambos os fundamentos da decisão de inadmissibilidade, os quais, à míngua de fundamentação pormenorizada, detalhada e específica, permanecem hígidos, produzindo todos os efeitos no mundo jurídico. Assim, ao deixar de infirmar os fundamentos do juízo de admissibilidade realizado pelo Tribunal de origem, o agravante fere o princípio da dialeticidade e atrai a incidência da previsão contida nos artigos 932, inciso III, do Código de Processo Civil, e 253, parágrafo único, inciso I, do Regimento Interno do STJ, no sentido de que não se conhece de agravo em recurso especial que ""não tenha impugnado especificamente todos os fundamentos da decisão recorrida"". Nesse sentido: TRIBUTÁRIO. AGRAVO INTERNO NO AGRAVO EM RECURSO ESPECIAL. AUSÊNCIA DE IMPUGNAÇÃO DE TODOS OS FUNDAMENTOS DA DECISÃO DE INADMISSIBILIDADE. AGRAVO INTERNO NÃO PROVIDO. (...) 4. A falta de efetivo combate de quaisquer dos fundamentos da decisão que inadmitiu o recurso especial impede o conhecimento do respectivo agravo, consoante preceituam os arts. 253, I, do Regimento Interno do Superior Tribunal de Justiça e 932, III, do Código de Processo Civil e a Súmula 182 do STJ. 5. Agravo interno não provido. (AgInt no AREsp n. 2.419.582/SP, rel. Min. Mauro Campbell Marques, Segunda Turma, DJe de 14/3/2024) Ante o exposto, com fundamento no artigo 253, parágrafo único, inciso I, do Regimento Interno do Superior Tribunal de Justiça, não conheço do agravo em recurso especial. Caso exista nos autos prévia fixação de honorários advocatícios pelas instâncias de origem, determino sua majoração em desfavor da parte agravante, no importe de 10% sobre o valor já arbitrado, nos termos do art. 85, § 11, do Código de Processo Civil. Deverão ser observados, se aplicáveis, os limites percentuais previstos nos §§ 2º e 3º do dispositivo legal acima referido, bem como eventuais legislações extravagantes que tratem do arbitramento de honorários e as hipóteses de concessão de gratuidade de justiça. Publique-se. Intimem-se. Brasília, 02 de outubro de 2025. MARIA THEREZA DE ASSIS MOURA Relatora",https://processo.stj.jus.brhttps://processo.stj.jus.br/processo/pesquisa/?num_registro=202502999610;,
352,Decisões Monocráticas (1.055),AREsp 3003067,Ministro HERMAN BENJAMIN,DJEN 06/10/2025,"AGRAVO EM RECURSO ESPECIAL Nº 3003067 - SP (2025/0283284-0) DECISÃO Cuida-se de Agravo apresentado por THAYNARA SOARES BARBOSA à decisão que não admitiu seu Recurso Especial. O apelo, fundamentado no artigo 105, III, alínea ""a"", da CF/88, visa reformar acórdão proferido pelo TRIBUNAL DE JUSTIÇA DO ESTADO DE SÃO PAULO, assim resumido: APELAÇÃO - ACIDENTE DE TRÂNSITO - DANOS MATERIAIS E MORAIS - COLISÃO ENTRE AUTOMÓVEL E BICICLETA - SENTENÇA DE IMPROCEDÊNCIA - RECURSO DA AUTORA. ELEMENTOS DE CONVICÇÃO SUFICIENTES DA CULPA DA APELADA PELA COLISÃO - DEPOIMENTO PESSOAL DA AUTORA QUE ALEGA QUE OLHOU NO RETROVISOR E ABRIU A PORTA LENTAMENTE - ABERTURA IMPRUDENTE DA PORTA DO VEÍCULO QUE INTERCEPTOU A TRAJETÓRIA DA BICICLETA - INTELIGÊNCIA DO ART. 49 DO CTB. PRONTUÁRIO MÉDICO QUE CONSTOU NO DIA DOS FATOS TRAUMA LEVE, DOR LEVE, SEM PERDA DA FUNÇÃO - RELATÓRIOS QUE ATESTAM AS LESÕES NO JOELHO ESQUERDO FORAM CONFECCIONADOS APÓS 02 MESES DOS FATOS NARRADOS NA INICIAL. NECESSIDADE DE REALIZAÇÃO DE PERÍCIA NA AUTORA A FIM DE QUE SEJA CONSTATADO SE AS LESÕES NO JOELHO DA AUTORA FORAM EM DECORRÊNCIA DO ACIDENTE DESCRITO NA INICIAL. SENTENÇA ANULADA - ""EX OFFICIO"" Quanto à controvérsia, pela alínea ""a"" do permissivo constitucional, a parte recorrente aduz ofensa aos arts. 141 e 492 do CPC, no que concerne à necessidade de reconhecimento da nulidade do acórdão recorrido por decisão extra petita/ultra petita, visto que acórdão recor rido anulou a sentença sem que qualquer das partes houvesse formulado pedido específico para tanto, configurando julgamento além do que foi requerido na apelação, em clara violação ao princípio da congruência e ao dever de adstrição ao pedido. Argumenta: O acórdão recorrido violou os arts. 141 e 492 do CPC ao conceder provimento diverso do pedido, em nítida violação ao princípio da adstrição. O art. 141 do CPC consagra o princípio da congruência ou princípio da adstrição ao pedido, o qual impõe ao julgador o dever de se manter dentro dos limites daquilo que foi requerido pelas partes. Assim, ao anular a sentença sem que nenhuma das partes tivesse formulado tal pedido, o tribunal extrapolou os limites da demanda, configurando decisão extra petita. Já o art. 492 do CPC complementa o art. 141 e veda expressamente ao julgador julgar além (ultra petita), aquém (citra petita) ou fora (extra petita) do que foi pedido. A anulação de sentença sem requerimento específico configura decisão ultra ou extra petita, pois modifica substancialmente o conteúdo da lide sem provocação da parte (fls.321-322). É o relatório. Decido. Quanto à controvérsia, incide a Súmula n. 211/STJ, porquanto a questão não foi examinada pela Corte de origem, a despeito da oposição de Embargos de Declaração. Assim, ausente o requisito do prequestionamento. Nesse sentido: ""A ausência de enfrentamento da questão objeto da controvérsia pelo Tribunal a quo, não obstante oposição de embargos declaratórios, impede o acesso à instância especial, porquanto não preenchido o requisito constitucional do prequestionamento, nos termos da Súmula n. 211/STJ"" (AgInt nos EDcl no REsp n. 1.738.596/RJ, relatora Ministra Regina Helena Costa, Primeira Turma, ;DJEN de 26/3/2025). Na mesma linha: ""A alegada violação ao art. 489, § 1º, I, II, III e IV, do CPC não foi examinada pelo Tribunal de origem, nada obstante a oposição de embargos de declaração. Logo, incide a Súmula n. 211/STJ, porquanto ausente o indispensável prequestionamento"" (AgInt no AREsp n. 2.100.337/MG, relator Ministro Sérgio Kukina, Primeira Turma, DJEN de 21/3/2025). Confiram-se ainda os seguintes julgados: EDcl nos EDcl no AgRg no AREsp n. 2.545.573/ES, relator Ministro Antonio Saldanha Palheiro, Sexta Turma, DJEN de 25/3/2025; AgRg no AREsp n. 2.466.924/SP, relator Ministro Joel Ilan Paciornik, Quinta Turma, DJEN de 26/3/2025; AREsp n. 2.832.933/GO, relator Ministro Moura Ribeiro, Terceira Turma, DJEN de 21/3/2025; AREsp n. 2.802.139/RJ, relatora Ministra Nancy Andrighi, Terceira Turma, DJEN de 27/3/2025; AREsp n. 1.354.597/PR, relator Ministro Humberto Martins, Terceira Turma, DJEN de 20/3/2025; REsp n. 2.073.535/SP, relator Ministro Ricardo Villas Bôas Cueva, Terceira Turma, DJEN de 20/3/2025; AgInt no AREsp n. 2.623.773/GO, relator Ministro Teodoro Silva Santos, Segunda Turma, DJEN de 18/3/2025; AgInt no AREsp n. 2.243.277/SP, relator Ministro Marco Aurélio Bellizze, Segunda Turma, DJEN de 19/3/2025; AgRg no REsp n. 2.100.417/RJ, relator Ministro Reynaldo Soares da Fonseca, Quinta Turma, DJEN de 10/3/2025; AgInt nos EDcl no AREsp n. 2.569.581/SP, relator Ministro Antonio Carlos Ferreira, Quarta Turma, DJEN de 28/2/2025; AgInt no AREsp n. 2.503.989/MG, relator Ministro Raul Araújo, Quarta Turma, DJEN de 27/2/2025. Ante o exposto, com base no art. 21-E, V, do Regimento Interno do Superior Tribunal de Justiça, conheço do Agravo para não conhecer do Recurso Especial. Nos termos do art. 85, § 11, do Código de Processo Civil, majoro os honorários de advogado em desfavor da parte recorrente em 15% sobre o valor já arbitrado nas instâncias de origem, observados, se aplicáveis, os limites percentuais previstos nos §§ 2º e 3º do referido dispositivo legal, bem como eventual concessão de justiça gratuita. Publique-se. Intimem-se. Brasília, 01 de outubro de 2025. Ministro Herman Benjamin Presidente",https://processo.stj.jus.brhttps://processo.stj.jus.br/processo/pesquisa/?num_registro=202502832840;,
